{
  "envelope_version": "2.0",
  "message_id": "00000000-0000-0000-0000-000000000000",
  "thread_id":  "00000000-0000-0000-0000-000000000000",
  "parent_id":  null,
  "from": { "eidolon": "apivr", "version": "3.7.1" },
  "to":   { "eidolon": "idg",   "version": "n/a" },
  "performative": "PROPOSE",
  "edge_origin": "roster",
  "objective": "Hand off APIVR-Δ completion report for IDG to chronicle.",
  "artifact": {
    "kind": "apivr-completion-report",
    "schema_version": "1.0",
    "path": ".eidolons/apivr/output/completion.md",
    "sha256": "0000000000000000000000000000000000000000000000000000000000000000",
    "size_bytes": 0
  },
  "context_delta": {
    "token_budget": 5000,
    "tokens_used": 0,
    "input_handles": [],
    "summary": "APIVR-Δ implementation complete. Fill tokens_used, sha256, size_bytes, and summary at emit time."
  },
  "constraints": { "trust_level": "standard" },
  "ise": {
    "assertion_grade": "self-attested",
    "provenance": {
      "methodology_version": "apivr-3.7.1"
    },
    "receiver_authorization": {
      "auto_route": true,
      "auto_merge": false,
      "auto_deploy": false
    }
  },
  "expected_response": {
    "performative": "ACKNOWLEDGE",
    "shape_hint": "chronicle entry in IDG format"
  },
  "confidence": 1.0,
  "assumptions": [],
  "integrity": {
    "method": "sha256",
    "value": "0000000000000000000000000000000000000000000000000000000000000000"
  },
  "trace": {
    "ts": "1970-01-01T00:00:00Z",
    "host": "claude-code",
    "model": "claude-sonnet-4-6",
    "tier": "standard"
  }
}
