{
  "envelope_version": "2.0",
  "message_id": "00000000-0000-0000-0000-000000000000",
  "thread_id":  "00000000-0000-0000-0000-000000000000",
  "parent_id":  null,
  "from": { "eidolon": "apivr", "version": "3.7.1" },
  "to":   { "eidolon": "forge", "version": "n/a" },
  "performative": "REQUEST",
  "edge_origin": "roster",
  "objective": "Request adversarial reasoning from FORGE on a Plan-phase trade-off.",
  "artifact": {
    "kind": "reasoning-request",
    "schema_version": "1.0",
    "path": ".eidolons/apivr/output/reasoning-request.md",
    "sha256": "0000000000000000000000000000000000000000000000000000000000000000",
    "size_bytes": 0
  },
  "context_delta": {
    "token_budget": 3000,
    "tokens_used": 0,
    "input_handles": [],
    "summary": "APIVR-Δ consulting FORGE on a trade-off. Body MUST contain: question, context, constraints, candidate_answers. Fill tokens_used, sha256, size_bytes, and summary at emit time."
  },
  "constraints": { "trust_level": "standard" },
  "ise": {
    "assertion_grade": "self-attested",
    "provenance": {
      "methodology_version": "apivr-3.7.1"
    },
    "receiver_authorization": {
      "auto_route": true,
      "auto_merge": false,
      "auto_deploy": false
    }
  },
  "expected_response": {
    "performative": "PROPOSE",
    "shape_hint": "reasoning-report"
  },
  "confidence": 0.7,
  "assumptions": [],
  "integrity": {
    "method": "sha256",
    "value": "0000000000000000000000000000000000000000000000000000000000000000"
  },
  "trace": {
    "ts": "1970-01-01T00:00:00Z",
    "host": "claude-code",
    "model": "claude-sonnet-4-6",
    "tier": "standard"
  }
}
